{
  "schema_version": 1,
  "measured_at": "2026-08-12T05:43:54.378003+00:00",
  "corpus": {
    "classification": "provisional-regression",
    "corpus_ids": [
      "koguard-provisional-ablation-v1"
    ],
    "sha256": "0a735367a724d3c11bc868aecf2209c536b2699d8823828be87d100aa01caa0f",
    "case_count": 20,
    "positive_count": 11,
    "hard_negative_count": 9,
    "excluded_review_count": 0
  },
  "environment": {
    "koguard_version": "0.1.0",
    "python_version": "3.11.9",
    "implementation": "CPython",
    "platform": "Windows-10-10.0.26200-SP0",
    "processor": "Intel64 Family 6 Model 170 Stepping 4, GenuineIntel"
  },
  "configuration": {
    "iterations": 100,
    "warmups": 10,
    "profile_configuration_sha256": "3fcd74ed874c2cafe514b1497c65e07b06421eb2807c09583184b76ad7b7fb93",
    "workloads": [
      {
        "workload_id": "short_chat",
        "input_length": 15,
        "sha256": "e40b61e7150bac2daf644dcc8f287f53864d62f9a82f100edde6fcf326f9dde4"
      },
      {
        "workload_id": "maximum_input",
        "input_length": 4096,
        "sha256": "8f13cf6f530d53ddba47fc5515034cce5841077fcf0473ea1ae761b923eeceba"
      }
    ]
  },
  "profiles": [
    {
      "profile_id": "exact-alias",
      "role": "baseline",
      "matcher": null,
      "comparison_profile": null,
      "settings": {
        "alias_matching": true,
        "choseong_matching": false,
        "exact_matching": true,
        "fuzzy_matching": false,
        "fuzzy_max_distance": 1,
        "fuzzy_max_index_entries": 100000,
        "fuzzy_max_operations": 250000,
        "fuzzy_max_term_length": 32,
        "fuzzy_min_score": 0.0,
        "fuzzy_min_term_length": 3,
        "jamo_composition_matching": false,
        "keyboard_matching": false,
        "max_input_length": 4096,
        "max_whitespace_gap": 3,
        "mixed_gap_matching": false,
        "obfuscation_separators": "!#$%&*+,-.=@^_~·",
        "repeat_reduction_threshold": 2,
        "repeated_matching": false,
        "segmented_input_matching": false,
        "separator_matching": false,
        "unicode_form": "NFKC",
        "whitespace_gap_matching": false
      },
      "sentence_metrics": {
        "counts": {
          "tp": 2,
          "fp": 1,
          "fn": 9,
          "tn": 8
        },
        "precision": 0.6666666666666666,
        "recall": 0.18181818181818182,
        "f1": 0.28571428571428575,
        "accuracy": 0.5
      },
      "occurrence_metrics": {
        "counts": {
          "tp": 2,
          "fp": 1,
          "fn": 9
        },
        "precision": 0.6666666666666666,
        "recall": 0.18181818181818182,
        "f1": 0.28571428571428575
      },
      "slice_metrics": [
        {
          "slice": "alias",
          "case_count": 1,
          "sentence_metrics": {
            "counts": {
              "tp": 1,
              "fp": 0,
              "fn": 0,
              "tn": 0
            },
            "precision": 1.0,
            "recall": 1.0,
            "f1": 1.0,
            "accuracy": 1.0
          },
          "occurrence_metrics": {
            "counts": {
              "tp": 1,
              "fp": 0,
              "fn": 0
            },
            "precision": 1.0,
            "recall": 1.0,
            "f1": 1.0
          }
        },
        {
          "slice": "benign-substring",
          "case_count": 4,
          "sentence_metrics": {
            "counts": {
              "tp": 0,
              "fp": 1,
              "fn": 0,
              "tn": 3
            },
            "precision": 0.0,
            "recall": null,
            "f1": null,
            "accuracy": 0.75
          },
          "occurrence_metrics": {
            "counts": {
              "tp": 0,
              "fp": 1,
              "fn": 0
            },
            "precision": 0.0,
            "recall": null,
            "f1": null
          }
        },
        {
          "slice": "choseong",
          "case_count": 2,
          "sentence_metrics": {
            "counts": {
              "tp": 0,
              "fp": 0,
              "fn": 1,
              "tn": 1
            },
            "precision": null,
            "recall": 0.0,
            "f1": null,
            "accuracy": 0.5
          },
          "occurrence_metrics": {
            "counts": {
              "tp": 0,
              "fp": 0,
              "fn": 1
            },
            "precision": null,
            "recall": 0.0,
            "f1": null
          }
        },
        {
          "slice": "direct",
          "case_count": 1,
          "sentence_metrics": {
            "counts": {
              "tp": 1,
              "fp": 0,
              "fn": 0,
              "tn": 0
            },
            "precision": 1.0,
            "recall": 1.0,
            "f1": 1.0,
            "accuracy": 1.0
          },
          "occurrence_metrics": {
            "counts": {
              "tp": 1,
              "fp": 0,
              "fn": 0
            },
            "precision": 1.0,
            "recall": 1.0,
            "f1": 1.0
          }
        },
        {
          "slice": "domain-term",
          "case_count": 1,
          "sentence_metrics": {
            "counts": {
              "tp": 0,
              "fp": 0,
              "fn": 0,
              "tn": 1
            },
            "precision": null,
            "recall": null,
            "f1": null,
            "accuracy": 1.0
          },
          "occurrence_metrics": {
            "counts": {
              "tp": 0,
              "fp": 0,
              "fn": 0
            },
            "precision": null,
            "recall": null,
            "f1": null
          }
        },
        {
          "slice": "fuzzy",
          "case_count": 1,
          "sentence_metrics": {
            "counts": {
              "tp": 0,
              "fp": 0,
              "fn": 1,
              "tn": 0
            },
            "precision": null,
            "recall": 0.0,
            "f1": null,
            "accuracy": 0.0
          },
          "occurrence_metrics": {
            "counts": {
              "tp": 0,
              "fp": 0,
              "fn": 1
            },
            "precision": null,
            "recall": 0.0,
            "f1": null
          }
        },
        {
          "slice": "game-term",
          "case_count": 1,
          "sentence_metrics": {
            "counts": {
              "tp": 0,
              "fp": 0,
              "fn": 0,
              "tn": 1
            },
            "precision": null,
            "recall": null,
            "f1": null,
            "accuracy": 1.0
          },
          "occurrence_metrics": {
            "counts": {
              "tp": 0,
              "fp": 0,
              "fn": 0
            },
            "precision": null,
            "recall": null,
            "f1": null
          }
        },
        {
          "slice": "jamo",
          "case_count": 1,
          "sentence_metrics": {
            "counts": {
              "tp": 0,
              "fp": 0,
              "fn": 1,
              "tn": 0
            },
            "precision": null,
            "recall": 0.0,
            "f1": null,
            "accuracy": 0.0
          },
          "occurrence_metrics": {
            "counts": {
              "tp": 0,
              "fp": 0,
              "fn": 1
            },
            "precision": null,
            "recall": 0.0,
            "f1": null
          }
        },
        {
          "slice": "keyboard",
          "case_count": 3,
          "sentence_metrics": {
            "counts": {
              "tp": 0,
              "fp": 0,
              "fn": 2,
              "tn": 1
            },
            "precision": null,
            "recall": 0.0,
            "f1": null,
            "accuracy": 0.3333333333333333
          },
          "occurrence_metrics": {
            "counts": {
              "tp": 0,
              "fp": 0,
              "fn": 2
            },
            "precision": null,
            "recall": 0.0,
            "f1": null
          }
        },
        {
          "slice": "mixed-gap",
          "case_count": 2,
          "sentence_metrics": {
            "counts": {
              "tp": 0,
              "fp": 0,
              "fn": 2,
              "tn": 0
            },
            "precision": null,
            "recall": 0.0,
            "f1": null,
            "accuracy": 0.0
          },
          "occurrence_metrics": {
            "counts": {
              "tp": 0,
              "fp": 0,
              "fn": 2
            },
            "precision": null,
            "recall": 0.0,
            "f1": null
          }
        },
        {
          "slice": "repeated",
          "case_count": 1,
          "sentence_metrics": {
            "counts": {
              "tp": 0,
              "fp": 0,
              "fn": 1,
              "tn": 0
            },
            "precision": null,
            "recall": 0.0,
            "f1": null,
            "accuracy": 0.0
          },
          "occurrence_metrics": {
            "counts": {
              "tp": 0,
              "fp": 0,
              "fn": 1
            },
            "precision": null,
            "recall": 0.0,
            "f1": null
          }
        },
        {
          "slice": "separator",
          "case_count": 3,
          "sentence_metrics": {
            "counts": {
              "tp": 0,
              "fp": 0,
              "fn": 2,
              "tn": 1
            },
            "precision": null,
            "recall": 0.0,
            "f1": null,
            "accuracy": 0.3333333333333333
          },
          "occurrence_metrics": {
            "counts": {
              "tp": 0,
              "fp": 0,
              "fn": 2
            },
            "precision": null,
            "recall": 0.0,
            "f1": null
          }
        },
        {
          "slice": "token-boundary",
          "case_count": 1,